{
  "$schema":"https://json-schema.org/draft/2020-12/schema","$id":"h4l-mass-off-evaluation-spec-v2","type":"object","additionalProperties":false,
  "required":["schema_version","registration_artifact_id","nominal_artifact_id","prepared_artifact_id","population_id","protocol_sha256","candidate_keys","blocks","pairing_contract","budgets","matrix","screening_policy","gate_artifact_ids","source_history","rng","semantics","evidence_scope","specification_id"],
  "properties":{"schema_version":{"const":"h4l-mass-off-evaluation-spec-v2"},"registration_artifact_id":{"$ref":"#/$defs/digest"},"nominal_artifact_id":{"$ref":"#/$defs/digest"},"prepared_artifact_id":{"$ref":"#/$defs/digest"},"population_id":{"type":"string","minLength":1},"protocol_sha256":{"$ref":"#/$defs/digest"},"candidate_keys":{"type":"array","minItems":80,"maxItems":80,"uniqueItems":true},"blocks":{"type":"array","minItems":5,"maxItems":5,"items":{"type":"object","required":["seed","candidate_keys","block_id","pairing_contract_digest"]}},"pairing_contract":{"type":"object","required":["contract_id","pairing_scope","cross_seed_pairing","seeds","candidate_family_size","block_size","contract_digest"],"properties":{"contract_id":{"const":"h4l-mass-off-within-seed-joint-v1"},"pairing_scope":{"const":"within_seed"},"cross_seed_pairing":{"const":"none"},"seeds":{"const":[42,43,44,45,46]},"candidate_family_size":{"const":80},"block_size":{"const":16},"contract_digest":{"$ref":"#/$defs/digest"}}},"budgets":{"$ref":"#/$defs/budgets"},"matrix":{"$ref":"#/$defs/matrix"},"screening_policy":{"type":"object","required":["policy","replicas","required_failures_per_seed","sampling","q","seed","projection_rtol","projection_atol"]},"gate_artifact_ids":{"type":"array","minItems":2,"maxItems":2,"items":{"$ref":"#/$defs/digest"}},"source_history":{"type":"array"},"rng":{"const":{"algorithm":"sha256-first-64-big-endian","version":"h4l-stream-v1"}},"semantics":{"type":"object","required":["protocol_sha256","source_nominal_id","prepared_artifact_id","population_id","mass_edges","templates_digest","bundles_digest","candidate_keys","model_ids","mapping_digests","weight_semantics","development_probability","roles","value_function","estimator"]},"evidence_scope":{"const":"MC_only_exploratory_within_seed"},"specification_id":{"$ref":"#/$defs/digest"}},
  "$defs":{"digest":{"type":"string","pattern":"^[0-9a-f]{64}$"},"budgets":{"type":"object","const":{"mc_bootstrap":{"replicas":200,"seed":42001},"toys":{"injections":[0,1,2],"count":500,"seed":42},"t2":{"mu":1,"outer_replicas":20,"inner_toys":100,"seed":42}}},"unit":{"type":"object","additionalProperties":false,"required":["stage","mu","training_seed"],"properties":{"stage":{"enum":["mc-bootstrap","model-self","assessment","t2"]},"mu":{"enum":[0,1,2]},"training_seed":{"type":["integer","null"],"enum":[null,42,43,44,45,46]}}},"matrix":{"type":"array","minItems":36,"maxItems":36,"items":{"$ref":"#/$defs/unit"}}}
}
