{
  "blocks": [
    {
      "block_id": "seed-block:6f6ff5c9d7d93f700641d972f41c96367584dcd4d12209c7dedfa076ee89a5d0",
      "candidate_keys": [
        "M0off:42",
        "M3:42:groups=A:m4l=off",
        "M3:42:groups=B:m4l=off",
        "M3:42:groups=C:m4l=off",
        "M3:42:groups=D:m4l=off",
        "M3:42:groups=AB:m4l=off",
        "M3:42:groups=AC:m4l=off",
        "M3:42:groups=AD:m4l=off",
        "M3:42:groups=BC:m4l=off",
        "M3:42:groups=BD:m4l=off",
        "M3:42:groups=CD:m4l=off",
        "M3:42:groups=ABC:m4l=off",
        "M3:42:groups=ABD:m4l=off",
        "M3:42:groups=ACD:m4l=off",
        "M3:42:groups=BCD:m4l=off",
        "M3:42:groups=ABCD:m4l=off"
      ],
      "pairing_contract_digest": "9baedc4c4619894bb29a6ad0628af7d9af06cd2bc67d2783e5d1e9ef27cbc81f",
      "seed": 42
    },
    {
      "block_id": "seed-block:b67e51df6805275aff15c8363eeec595b3dd2ffb55a1973553665cf68bb195d2",
      "candidate_keys": [
        "M0off:43",
        "M3:43:groups=A:m4l=off",
        "M3:43:groups=B:m4l=off",
        "M3:43:groups=C:m4l=off",
        "M3:43:groups=D:m4l=off",
        "M3:43:groups=AB:m4l=off",
        "M3:43:groups=AC:m4l=off",
        "M3:43:groups=AD:m4l=off",
        "M3:43:groups=BC:m4l=off",
        "M3:43:groups=BD:m4l=off",
        "M3:43:groups=CD:m4l=off",
        "M3:43:groups=ABC:m4l=off",
        "M3:43:groups=ABD:m4l=off",
        "M3:43:groups=ACD:m4l=off",
        "M3:43:groups=BCD:m4l=off",
        "M3:43:groups=ABCD:m4l=off"
      ],
      "pairing_contract_digest": "9baedc4c4619894bb29a6ad0628af7d9af06cd2bc67d2783e5d1e9ef27cbc81f",
      "seed": 43
    },
    {
      "block_id": "seed-block:7127e963fadea6d59932f0382dfc3ef2fd44f0bcbb06186d1229dcd5c1e9cc34",
      "candidate_keys": [
        "M0off:44",
        "M3:44:groups=A:m4l=off",
        "M3:44:groups=B:m4l=off",
        "M3:44:groups=C:m4l=off",
        "M3:44:groups=D:m4l=off",
        "M3:44:groups=AB:m4l=off",
        "M3:44:groups=AC:m4l=off",
        "M3:44:groups=AD:m4l=off",
        "M3:44:groups=BC:m4l=off",
        "M3:44:groups=BD:m4l=off",
        "M3:44:groups=CD:m4l=off",
        "M3:44:groups=ABC:m4l=off",
        "M3:44:groups=ABD:m4l=off",
        "M3:44:groups=ACD:m4l=off",
        "M3:44:groups=BCD:m4l=off",
        "M3:44:groups=ABCD:m4l=off"
      ],
      "pairing_contract_digest": "9baedc4c4619894bb29a6ad0628af7d9af06cd2bc67d2783e5d1e9ef27cbc81f",
      "seed": 44
    },
    {
      "block_id": "seed-block:daedc3f0ae81afcfad2009b498800d7c146d9b6d8964458762cbba784da1bc7d",
      "candidate_keys": [
        "M0off:45",
        "M3:45:groups=A:m4l=off",
        "M3:45:groups=B:m4l=off",
        "M3:45:groups=C:m4l=off",
        "M3:45:groups=D:m4l=off",
        "M3:45:groups=AB:m4l=off",
        "M3:45:groups=AC:m4l=off",
        "M3:45:groups=AD:m4l=off",
        "M3:45:groups=BC:m4l=off",
        "M3:45:groups=BD:m4l=off",
        "M3:45:groups=CD:m4l=off",
        "M3:45:groups=ABC:m4l=off",
        "M3:45:groups=ABD:m4l=off",
        "M3:45:groups=ACD:m4l=off",
        "M3:45:groups=BCD:m4l=off",
        "M3:45:groups=ABCD:m4l=off"
      ],
      "pairing_contract_digest": "9baedc4c4619894bb29a6ad0628af7d9af06cd2bc67d2783e5d1e9ef27cbc81f",
      "seed": 45
    },
    {
      "block_id": "seed-block:d3ea41fdbc308220573c679048c0d9ab8a1ffee59d2383a1cc9a009df26846ab",
      "candidate_keys": [
        "M0off:46",
        "M3:46:groups=A:m4l=off",
        "M3:46:groups=B:m4l=off",
        "M3:46:groups=C:m4l=off",
        "M3:46:groups=D:m4l=off",
        "M3:46:groups=AB:m4l=off",
        "M3:46:groups=AC:m4l=off",
        "M3:46:groups=AD:m4l=off",
        "M3:46:groups=BC:m4l=off",
        "M3:46:groups=BD:m4l=off",
        "M3:46:groups=CD:m4l=off",
        "M3:46:groups=ABC:m4l=off",
        "M3:46:groups=ABD:m4l=off",
        "M3:46:groups=ACD:m4l=off",
        "M3:46:groups=BCD:m4l=off",
        "M3:46:groups=ABCD:m4l=off"
      ],
      "pairing_contract_digest": "9baedc4c4619894bb29a6ad0628af7d9af06cd2bc67d2783e5d1e9ef27cbc81f",
      "seed": 46
    }
  ],
  "budgets": {
    "mc_bootstrap": {
      "replicas": 200,
      "seed": 42001
    },
    "t2": {
      "inner_toys": 100,
      "mu": 1,
      "outer_replicas": 20,
      "seed": 42
    },
    "toys": {
      "count": 500,
      "injections": [
        0,
        1,
        2
      ],
      "seed": 42
    }
  },
  "candidate_keys": [
    "M0off:42",
    "M3:42:groups=A:m4l=off",
    "M3:42:groups=B:m4l=off",
    "M3:42:groups=C:m4l=off",
    "M3:42:groups=D:m4l=off",
    "M3:42:groups=AB:m4l=off",
    "M3:42:groups=AC:m4l=off",
    "M3:42:groups=AD:m4l=off",
    "M3:42:groups=BC:m4l=off",
    "M3:42:groups=BD:m4l=off",
    "M3:42:groups=CD:m4l=off",
    "M3:42:groups=ABC:m4l=off",
    "M3:42:groups=ABD:m4l=off",
    "M3:42:groups=ACD:m4l=off",
    "M3:42:groups=BCD:m4l=off",
    "M3:42:groups=ABCD:m4l=off",
    "M0off:43",
    "M3:43:groups=A:m4l=off",
    "M3:43:groups=B:m4l=off",
    "M3:43:groups=C:m4l=off",
    "M3:43:groups=D:m4l=off",
    "M3:43:groups=AB:m4l=off",
    "M3:43:groups=AC:m4l=off",
    "M3:43:groups=AD:m4l=off",
    "M3:43:groups=BC:m4l=off",
    "M3:43:groups=BD:m4l=off",
    "M3:43:groups=CD:m4l=off",
    "M3:43:groups=ABC:m4l=off",
    "M3:43:groups=ABD:m4l=off",
    "M3:43:groups=ACD:m4l=off",
    "M3:43:groups=BCD:m4l=off",
    "M3:43:groups=ABCD:m4l=off",
    "M0off:44",
    "M3:44:groups=A:m4l=off",
    "M3:44:groups=B:m4l=off",
    "M3:44:groups=C:m4l=off",
    "M3:44:groups=D:m4l=off",
    "M3:44:groups=AB:m4l=off",
    "M3:44:groups=AC:m4l=off",
    "M3:44:groups=AD:m4l=off",
    "M3:44:groups=BC:m4l=off",
    "M3:44:groups=BD:m4l=off",
    "M3:44:groups=CD:m4l=off",
    "M3:44:groups=ABC:m4l=off",
    "M3:44:groups=ABD:m4l=off",
    "M3:44:groups=ACD:m4l=off",
    "M3:44:groups=BCD:m4l=off",
    "M3:44:groups=ABCD:m4l=off",
    "M0off:45",
    "M3:45:groups=A:m4l=off",
    "M3:45:groups=B:m4l=off",
    "M3:45:groups=C:m4l=off",
    "M3:45:groups=D:m4l=off",
    "M3:45:groups=AB:m4l=off",
    "M3:45:groups=AC:m4l=off",
    "M3:45:groups=AD:m4l=off",
    "M3:45:groups=BC:m4l=off",
    "M3:45:groups=BD:m4l=off",
    "M3:45:groups=CD:m4l=off",
    "M3:45:groups=ABC:m4l=off",
    "M3:45:groups=ABD:m4l=off",
    "M3:45:groups=ACD:m4l=off",
    "M3:45:groups=BCD:m4l=off",
    "M3:45:groups=ABCD:m4l=off",
    "M0off:46",
    "M3:46:groups=A:m4l=off",
    "M3:46:groups=B:m4l=off",
    "M3:46:groups=C:m4l=off",
    "M3:46:groups=D:m4l=off",
    "M3:46:groups=AB:m4l=off",
    "M3:46:groups=AC:m4l=off",
    "M3:46:groups=AD:m4l=off",
    "M3:46:groups=BC:m4l=off",
    "M3:46:groups=BD:m4l=off",
    "M3:46:groups=CD:m4l=off",
    "M3:46:groups=ABC:m4l=off",
    "M3:46:groups=ABD:m4l=off",
    "M3:46:groups=ACD:m4l=off",
    "M3:46:groups=BCD:m4l=off",
    "M3:46:groups=ABCD:m4l=off"
  ],
  "evidence_scope": "MC_only_exploratory_within_seed",
  "gate_artifact_ids": [
    "aaaaaaaaaaaaaaaaaaaaaaaaaaaaaaaaaaaaaaaaaaaaaaaaaaaaaaaaaaaaaaaa",
    "aaaaaaaaaaaaaaaaaaaaaaaaaaaaaaaaaaaaaaaaaaaaaaaaaaaaaaaaaaaaaaaa"
  ],
  "matrix": [
    {
      "mu": 1,
      "stage": "mc-bootstrap",
      "training_seed": null
    },
    {
      "mu": 0,
      "stage": "model-self",
      "training_seed": 42
    },
    {
      "mu": 0,
      "stage": "model-self",
      "training_seed": 43
    },
    {
      "mu": 0,
      "stage": "model-self",
      "training_seed": 44
    },
    {
      "mu": 0,
      "stage": "model-self",
      "training_seed": 45
    },
    {
      "mu": 0,
      "stage": "model-self",
      "training_seed": 46
    },
    {
      "mu": 1,
      "stage": "model-self",
      "training_seed": 42
    },
    {
      "mu": 1,
      "stage": "model-self",
      "training_seed": 43
    },
    {
      "mu": 1,
      "stage": "model-self",
      "training_seed": 44
    },
    {
      "mu": 1,
      "stage": "model-self",
      "training_seed": 45
    },
    {
      "mu": 1,
      "stage": "model-self",
      "training_seed": 46
    },
    {
      "mu": 2,
      "stage": "model-self",
      "training_seed": 42
    },
    {
      "mu": 2,
      "stage": "model-self",
      "training_seed": 43
    },
    {
      "mu": 2,
      "stage": "model-self",
      "training_seed": 44
    },
    {
      "mu": 2,
      "stage": "model-self",
      "training_seed": 45
    },
    {
      "mu": 2,
      "stage": "model-self",
      "training_seed": 46
    },
    {
      "mu": 0,
      "stage": "assessment",
      "training_seed": 42
    },
    {
      "mu": 0,
      "stage": "assessment",
      "training_seed": 43
    },
    {
      "mu": 0,
      "stage": "assessment",
      "training_seed": 44
    },
    {
      "mu": 0,
      "stage": "assessment",
      "training_seed": 45
    },
    {
      "mu": 0,
      "stage": "assessment",
      "training_seed": 46
    },
    {
      "mu": 1,
      "stage": "assessment",
      "training_seed": 42
    },
    {
      "mu": 1,
      "stage": "assessment",
      "training_seed": 43
    },
    {
      "mu": 1,
      "stage": "assessment",
      "training_seed": 44
    },
    {
      "mu": 1,
      "stage": "assessment",
      "training_seed": 45
    },
    {
      "mu": 1,
      "stage": "assessment",
      "training_seed": 46
    },
    {
      "mu": 2,
      "stage": "assessment",
      "training_seed": 42
    },
    {
      "mu": 2,
      "stage": "assessment",
      "training_seed": 43
    },
    {
      "mu": 2,
      "stage": "assessment",
      "training_seed": 44
    },
    {
      "mu": 2,
      "stage": "assessment",
      "training_seed": 45
    },
    {
      "mu": 2,
      "stage": "assessment",
      "training_seed": 46
    },
    {
      "mu": 1,
      "stage": "t2",
      "training_seed": 42
    },
    {
      "mu": 1,
      "stage": "t2",
      "training_seed": 43
    },
    {
      "mu": 1,
      "stage": "t2",
      "training_seed": 44
    },
    {
      "mu": 1,
      "stage": "t2",
      "training_seed": 45
    },
    {
      "mu": 1,
      "stage": "t2",